[INFO] Scanning for projects...
[INFO] 
[INFO] ------------------------< com.jpmc:midas-core >-------------------------
[INFO] Building midas-core 1.0.0
[INFO] --------------------------------[ jar ]---------------------------------
[INFO] 
[INFO] --- maven-resources-plugin:3.3.1:resources (default-resources) @ midas-core ---
[INFO] skip non existing resourceDirectory D:\NJIT FILES\Stimulations\JPMC_Project\forage-midas-flow\src\main\resources
[INFO] skip non existing resourceDirectory D:\NJIT FILES\Stimulations\JPMC_Project\forage-midas-flow\src\main\resources
[INFO] 
[INFO] --- maven-compiler-plugin:3.11.0:compile (default-compile) @ midas-core ---
[INFO] Nothing to compile - all classes are up to date
[INFO] 
[INFO] --- maven-resources-plugin:3.3.1:testResources (default-testResources) @ midas-core ---
[INFO] Copying 5 resources from src\test\resources to target\test-classes
[INFO] 
[INFO] --- maven-compiler-plugin:3.11.0:testCompile (default-testCompile) @ midas-core ---
[INFO] Nothing to compile - all classes are up to date
[INFO] 
[INFO] --- maven-surefire-plugin:3.1.2:test (default-test) @ midas-core ---
[INFO] Using auto detected provider org.apache.maven.surefire.junitplatform.JUnitPlatformProvider
[INFO] 
[INFO] -------------------------------------------------------
[INFO]  T E S T S
[INFO] -------------------------------------------------------
[INFO] Running com.jpmc.midascore.TaskOneTests
14:36:02.348 [main] INFO org.springframework.test.context.support.AnnotationConfigContextLoaderUtils -- Could not detect default configuration classes for test class [com.jpmc.midascore.TaskOneTests]: TaskOneTests does not declare any static, non-private, non-final, nested classes annotated with @Configuration.
14:36:02.501 [main] INFO org.springframework.boot.test.context.SpringBootTestContextBootstrapper -- Found @SpringBootConfiguration com.jpmc.midascore.MidasCoreApplication for test class com.jpmc.midascore.TaskOneTests

  .   ____          _            __ _ _
 /\\ / ___'_ __ _ _(_)_ __  __ _ \ \ \ \
( ( )\___ | '_ | '_| | '_ \/ _` | \ \ \ \
 \\/  ___)| |_)| | | | | || (_| |  ) ) ) )
  '  |____| .__|_| |_|_| |_\__, | / / / /
 =========|_|==============|___/=/_/_/_/
 :: Spring Boot ::                (v3.2.5)

2025-10-30T14:36:03.035-04:00  INFO 29144 --- [           main] com.jpmc.midascore.TaskOneTests          : Starting TaskOneTests using Java 25.0.1 with PID 29144 (started by HP in D:\NJIT FILES\Stimulations\JPMC_Project\forage-midas-flow)
2025-10-30T14:36:03.037-04:00  INFO 29144 --- [           main] com.jpmc.midascore.TaskOneTests          : No active profile set, falling back to 1 default profile: "default"
2025-10-30T14:36:03.823-04:00  INFO 29144 --- [           main] .s.d.r.c.RepositoryConfigurationDelegate : Bootstrapping Spring Data JPA repositories in DEFAULT mode.
2025-10-30T14:36:03.890-04:00  INFO 29144 --- [           main] .s.d.r.c.RepositoryConfigurationDelegate : Finished Spring Data repository scanning in 56 ms. Found 1 JPA repository interface.
2025-10-30T14:36:04.472-04:00  INFO 29144 --- [           main] com.zaxxer.hikari.HikariDataSource       : HikariPool-1 - Starting...
2025-10-30T14:36:04.672-04:00  INFO 29144 --- [           main] com.zaxxer.hikari.pool.HikariPool        : HikariPool-1 - Added connection conn0: url=jdbc:h2:mem:2b26615d-abc5-4c73-8804-8b7181bcfe9d user=SA
2025-10-30T14:36:04.674-04:00  INFO 29144 --- [           main] com.zaxxer.hikari.HikariDataSource       : HikariPool-1 - Start completed.
2025-10-30T14:36:04.728-04:00  INFO 29144 --- [           main] o.hibernate.jpa.internal.util.LogHelper  : HHH000204: Processing PersistenceUnitInfo [name: default]
2025-10-30T14:36:04.793-04:00  INFO 29144 --- [           main] org.hibernate.Version                    : HHH000412: Hibernate ORM core version 6.4.4.Final
2025-10-30T14:36:04.849-04:00  INFO 29144 --- [           main] o.h.c.internal.RegionFactoryInitiator    : HHH000026: Second-level cache disabled
2025-10-30T14:36:05.125-04:00  INFO 29144 --- [           main] o.s.o.j.p.SpringPersistenceUnitInfo      : No LoadTimeWeaver setup: ignoring JPA class transformer
2025-10-30T14:36:06.298-04:00  INFO 29144 --- [           main] o.h.e.t.j.p.i.JtaPlatformInitiator       : HHH000489: No JTA platform available (set 'hibernate.transaction.jta.platform' to enable JTA platform integration)
2025-10-30T14:36:06.330-04:00  INFO 29144 --- [           main] j.LocalContainerEntityManagerFactoryBean : Initialized JPA EntityManagerFactory for persistence unit 'default'
2025-10-30T14:36:06.492-04:00  WARN 29144 --- [           main] o.s.w.c.s.GenericWebApplicationContext   : Exception encountered during context initialization - cancelling refresh attempt: org.springframework.beans.factory.BeanCreationException: Error creating bean with name 'kafkaProducer' defined in file [D:\NJIT FILES\Stimulations\JPMC_Project\forage-midas-flow\target\test-classes\com\jpmc\midascore\KafkaProducer.class]: Unexpected exception during bean creation
2025-10-30T14:36:06.492-04:00  INFO 29144 --- [           main] j.LocalContainerEntityManagerFactoryBean : Closing JPA EntityManagerFactory for persistence unit 'default'
2025-10-30T14:36:06.498-04:00  INFO 29144 --- [           main] com.zaxxer.hikari.HikariDataSource       : HikariPool-1 - Shutdown initiated...
2025-10-30T14:36:06.502-04:00  INFO 29144 --- [           main] com.zaxxer.hikari.HikariDataSource       : HikariPool-1 - Shutdown completed.
2025-10-30T14:36:06.517-04:00  INFO 29144 --- [           main] .s.b.a.l.ConditionEvaluationReportLogger : 

Error starting ApplicationContext. To display the condition evaluation report re-run your application with 'debug' enabled.
2025-10-30T14:36:06.549-04:00 ERROR 29144 --- [           main] o.s.boot.SpringApplication               : Application run failed

org.springframework.beans.factory.BeanCreationException: Error creating bean with name 'kafkaProducer' defined in file [D:\NJIT FILES\Stimulations\JPMC_Project\forage-midas-flow\target\test-classes\com\jpmc\midascore\KafkaProducer.class]: Unexpected exception during bean creation
	at org.springframework.beans.factory.support.AbstractAutowireCapableBeanFactory.createBean(AbstractAutowireCapableBeanFactory.java:535) ~[spring-beans-6.1.6.jar:6.1.6]
	at org.springframework.beans.factory.support.AbstractBeanFactory.lambda$doGetBean$0(AbstractBeanFactory.java:326) ~[spring-beans-6.1.6.jar:6.1.6]
	at org.springframework.beans.factory.support.DefaultSingletonBeanRegistry.getSingleton(DefaultSingletonBeanRegistry.java:234) ~[spring-beans-6.1.6.jar:6.1.6]
	at org.springframework.beans.factory.support.AbstractBeanFactory.doGetBean(AbstractBeanFactory.java:324) ~[spring-beans-6.1.6.jar:6.1.6]
	at org.springframework.beans.factory.support.AbstractBeanFactory.getBean(AbstractBeanFactory.java:200) ~[spring-beans-6.1.6.jar:6.1.6]
	at org.springframework.beans.factory.support.DefaultListableBeanFactory.preInstantiateSingletons(DefaultListableBeanFactory.java:975) ~[spring-beans-6.1.6.jar:6.1.6]
	at org.springframework.context.support.AbstractApplicationContext.finishBeanFactoryInitialization(AbstractApplicationContext.java:962) ~[spring-context-6.1.6.jar:6.1.6]
	at org.springframework.context.support.AbstractApplicationContext.refresh(AbstractApplicationContext.java:624) ~[spring-context-6.1.6.jar:6.1.6]
	at org.springframework.boot.SpringApplication.refresh(SpringApplication.java:754) ~[spring-boot-3.2.5.jar:3.2.5]
	at org.springframework.boot.SpringApplication.refreshContext(SpringApplication.java:456) ~[spring-boot-3.2.5.jar:3.2.5]
	at org.springframework.boot.SpringApplication.run(SpringApplication.java:334) ~[spring-boot-3.2.5.jar:3.2.5]
	at org.springframework.boot.test.context.SpringBootContextLoader.lambda$loadContext$3(SpringBootContextLoader.java:137) ~[spring-boot-test-3.2.5.jar:3.2.5]
	at org.springframework.util.function.ThrowingSupplier.get(ThrowingSupplier.java:58) ~[spring-core-6.1.6.jar:6.1.6]
	at org.springframework.util.function.ThrowingSupplier.get(ThrowingSupplier.java:46) ~[spring-core-6.1.6.jar:6.1.6]
	at org.springframework.boot.SpringApplication.withHook(SpringApplication.java:1454) ~[spring-boot-3.2.5.jar:3.2.5]
	at org.springframework.boot.test.context.SpringBootContextLoader$ContextLoaderHook.run(SpringBootContextLoader.java:553) ~[spring-boot-test-3.2.5.jar:3.2.5]
	at org.springframework.boot.test.context.SpringBootContextLoader.loadContext(SpringBootContextLoader.java:137) ~[spring-boot-test-3.2.5.jar:3.2.5]
	at org.springframework.boot.test.context.SpringBootContextLoader.loadContext(SpringBootContextLoader.java:108) ~[spring-boot-test-3.2.5.jar:3.2.5]
	at org.springframework.test.context.cache.DefaultCacheAwareContextLoaderDelegate.loadContextInternal(DefaultCacheAwareContextLoaderDelegate.java:225) ~[spring-test-6.1.6.jar:6.1.6]
	at org.springframework.test.context.cache.DefaultCacheAwareContextLoaderDelegate.loadContext(DefaultCacheAwareContextLoaderDelegate.java:152) ~[spring-test-6.1.6.jar:6.1.6]
	at org.springframework.test.context.support.DefaultTestContext.getApplicationContext(DefaultTestContext.java:130) ~[spring-test-6.1.6.jar:6.1.6]
	at org.springframework.test.context.web.ServletTestExecutionListener.setUpRequestContextIfNecessary(ServletTestExecutionListener.java:191) ~[spring-test-6.1.6.jar:6.1.6]
	at org.springframework.test.context.web.ServletTestExecutionListener.prepareTestInstance(ServletTestExecutionListener.java:130) ~[spring-test-6.1.6.jar:6.1.6]
	at org.springframework.test.context.TestContextManager.prepareTestInstance(TestContextManager.java:260) ~[spring-test-6.1.6.jar:6.1.6]
	at org.springframework.test.context.junit.jupiter.SpringExtension.postProcessTestInstance(SpringExtension.java:163) ~[spring-test-6.1.6.jar:6.1.6]
	at org.junit.jupiter.engine.descriptor.ClassBasedTestDescriptor.lambda$invokeTestInstancePostProcessors$10(ClassBasedTestDescriptor.java:378) ~[junit-jupiter-engine-5.10.2.jar:5.10.2]
	at org.junit.jupiter.engine.descriptor.ClassBasedTestDescriptor.executeAndMaskThrowable(ClassBasedTestDescriptor.java:383) ~[junit-jupiter-engine-5.10.2.jar:5.10.2]
	at org.junit.jupiter.engine.descriptor.ClassBasedTestDescriptor.lambda$invokeTestInstancePostProcessors$11(ClassBasedTestDescriptor.java:378) ~[junit-jupiter-engine-5.10.2.jar:5.10.2]
	at java.base/java.util.stream.ReferencePipeline$3$1.accept(ReferencePipeline.java:214) ~[na:na]
	at java.base/java.util.stream.ReferencePipeline$2$1.accept(ReferencePipeline.java:197) ~[na:na]
	at java.base/java.util.ArrayList$ArrayListSpliterator.forEachRemaining(ArrayList.java:1716) ~[na:na]
	at java.base/java.util.stream.AbstractPipeline.copyInto(AbstractPipeline.java:570) ~[na:na]
	at java.base/java.util.stream.AbstractPipeline.wrapAndCopyInto(AbstractPipeline.java:560) ~[na:na]
	at java.base/java.util.stream.StreamSpliterators$WrappingSpliterator.forEachRemaining(StreamSpliterators.java:315) ~[na:na]
	at java.base/java.util.stream.Streams$ConcatSpliterator.forEachRemaining(Streams.java:735) ~[na:na]
	at java.base/java.util.stream.Streams$ConcatSpliterator.forEachRemaining(Streams.java:734) ~[na:na]
	at java.base/java.util.stream.ReferencePipeline$Head.forEach(ReferencePipeline.java:803) ~[na:na]
	at org.junit.jupiter.engine.descriptor.ClassBasedTestDescriptor.invokeTestInstancePostProcessors(ClassBasedTestDescriptor.java:377) ~[junit-jupiter-engine-5.10.2.jar:5.10.2]
	at org.junit.jupiter.engine.descriptor.ClassBasedTestDescriptor.lambda$instantiateAndPostProcessTestInstance$6(ClassBasedTestDescriptor.java:290) ~[junit-jupiter-engine-5.10.2.jar:5.10.2]
	at org.junit.platform.engine.support.hierarchical.ThrowableCollector.execute(ThrowableCollector.java:73) ~[junit-platform-engine-1.10.2.jar:1.10.2]
	at org.junit.jupiter.engine.descriptor.ClassBasedTestDescriptor.instantiateAndPostProcessTestInstance(ClassBasedTestDescriptor.java:289) ~[junit-jupiter-engine-5.10.2.jar:5.10.2]
	at org.junit.jupiter.engine.descriptor.ClassBasedTestDescriptor.lambda$testInstancesProvider$4(ClassBasedTestDescriptor.java:279) ~[junit-jupiter-engine-5.10.2.jar:5.10.2]
	at java.base/java.util.Optional.orElseGet(Optional.java:364) ~[na:na]
	at org.junit.jupiter.engine.descriptor.ClassBasedTestDescriptor.lambda$testInstancesProvider$5(ClassBasedTestDescriptor.java:278) ~[junit-jupiter-engine-5.10.2.jar:5.10.2]
	at org.junit.jupiter.engine.execution.TestInstancesProvider.getTestInstances(TestInstancesProvider.java:31) ~[junit-jupiter-engine-5.10.2.jar:5.10.2]
	at org.junit.jupiter.engine.descriptor.TestMethodTestDescriptor.lambda$prepare$0(TestMethodTestDescriptor.java:106) ~[junit-jupiter-engine-5.10.2.jar:5.10.2]
	at org.junit.platform.engine.support.hierarchical.ThrowableCollector.execute(ThrowableCollector.java:73) ~[junit-platform-engine-1.10.2.jar:1.10.2]
	at org.junit.jupiter.engine.descriptor.TestMethodTestDescriptor.prepare(TestMethodTestDescriptor.java:105) ~[junit-jupiter-engine-5.10.2.jar:5.10.2]
	at org.junit.jupiter.engine.descriptor.TestMethodTestDescriptor.prepare(TestMethodTestDescriptor.java:69) ~[junit-jupiter-engine-5.10.2.jar:5.10.2]
	at org.junit.platform.engine.support.hierarchical.NodeTestTask.lambda$prepare$2(NodeTestTask.java:123) ~[junit-platform-engine-1.10.2.jar:1.10.2]
	at org.junit.platform.engine.support.hierarchical.ThrowableCollector.execute(ThrowableCollector.java:73) ~[junit-platform-engine-1.10.2.jar:1.10.2]
	at org.junit.platform.engine.support.hierarchical.NodeTestTask.prepare(NodeTestTask.java:123) ~[junit-platform-engine-1.10.2.jar:1.10.2]
	at org.junit.platform.engine.support.hierarchical.NodeTestTask.execute(NodeTestTask.java:90) ~[junit-platform-engine-1.10.2.jar:1.10.2]
	at java.base/java.util.ArrayList.forEach(ArrayList.java:1604) ~[na:na]
	at org.junit.platform.engine.support.hierarchical.SameThreadHierarchicalTestExecutorService.invokeAll(SameThreadHierarchicalTestExecutorService.java:41) ~[junit-platform-engine-1.10.2.jar:1.10.2]
	at org.junit.platform.engine.support.hierarchical.NodeTestTask.lambda$executeRecursively$6(NodeTestTask.java:155) ~[junit-platform-engine-1.10.2.jar:1.10.2]
	at org.junit.platform.engine.support.hierarchical.ThrowableCollector.execute(ThrowableCollector.java:73) ~[junit-platform-engine-1.10.2.jar:1.10.2]
	at org.junit.platform.engine.support.hierarchical.NodeTestTask.lambda$executeRecursively$8(NodeTestTask.java:141) ~[junit-platform-engine-1.10.2.jar:1.10.2]
	at org.junit.platform.engine.support.hierarchical.Node.around(Node.java:137) ~[junit-platform-engine-1.10.2.jar:1.10.2]
	at org.junit.platform.engine.support.hierarchical.NodeTestTask.lambda$executeRecursively$9(NodeTestTask.java:139) ~[junit-platform-engine-1.10.2.jar:1.10.2]
	at org.junit.platform.engine.support.hierarchical.ThrowableCollector.execute(ThrowableCollector.java:73) ~[junit-platform-engine-1.10.2.jar:1.10.2]
	at org.junit.platform.engine.support.hierarchical.NodeTestTask.executeRecursively(NodeTestTask.java:138) ~[junit-platform-engine-1.10.2.jar:1.10.2]
	at org.junit.platform.engine.support.hierarchical.NodeTestTask.execute(NodeTestTask.java:95) ~[junit-platform-engine-1.10.2.jar:1.10.2]
	at java.base/java.util.ArrayList.forEach(ArrayList.java:1604) ~[na:na]
	at org.junit.platform.engine.support.hierarchical.SameThreadHierarchicalTestExecutorService.invokeAll(SameThreadHierarchicalTestExecutorService.java:41) ~[junit-platform-engine-1.10.2.jar:1.10.2]
	at org.junit.platform.engine.support.hierarchical.NodeTestTask.lambda$executeRecursively$6(NodeTestTask.java:155) ~[junit-platform-engine-1.10.2.jar:1.10.2]
	at org.junit.platform.engine.support.hierarchical.ThrowableCollector.execute(ThrowableCollector.java:73) ~[junit-platform-engine-1.10.2.jar:1.10.2]
	at org.junit.platform.engine.support.hierarchical.NodeTestTask.lambda$executeRecursively$8(NodeTestTask.java:141) ~[junit-platform-engine-1.10.2.jar:1.10.2]
	at org.junit.platform.engine.support.hierarchical.Node.around(Node.java:137) ~[junit-platform-engine-1.10.2.jar:1.10.2]
	at org.junit.platform.engine.support.hierarchical.NodeTestTask.lambda$executeRecursively$9(NodeTestTask.java:139) ~[junit-platform-engine-1.10.2.jar:1.10.2]
	at org.junit.platform.engine.support.hierarchical.ThrowableCollector.execute(ThrowableCollector.java:73) ~[junit-platform-engine-1.10.2.jar:1.10.2]
	at org.junit.platform.engine.support.hierarchical.NodeTestTask.executeRecursively(NodeTestTask.java:138) ~[junit-platform-engine-1.10.2.jar:1.10.2]
	at org.junit.platform.engine.support.hierarchical.NodeTestTask.execute(NodeTestTask.java:95) ~[junit-platform-engine-1.10.2.jar:1.10.2]
	at org.junit.platform.engine.support.hierarchical.SameThreadHierarchicalTestExecutorService.submit(SameThreadHierarchicalTestExecutorService.java:35) ~[junit-platform-engine-1.10.2.jar:1.10.2]
	at org.junit.platform.engine.support.hierarchical.HierarchicalTestExecutor.execute(HierarchicalTestExecutor.java:57) ~[junit-platform-engine-1.10.2.jar:1.10.2]
	at org.junit.platform.engine.support.hierarchical.HierarchicalTestEngine.execute(HierarchicalTestEngine.java:54) ~[junit-platform-engine-1.10.2.jar:1.10.2]
	at org.junit.platform.launcher.core.EngineExecutionOrchestrator.execute(EngineExecutionOrchestrator.java:198) ~[junit-platform-launcher-1.10.2.jar:1.10.2]
	at org.junit.platform.launcher.core.EngineExecutionOrchestrator.execute(EngineExecutionOrchestrator.java:169) ~[junit-platform-launcher-1.10.2.jar:1.10.2]
	at org.junit.platform.launcher.core.EngineExecutionOrchestrator.execute(EngineExecutionOrchestrator.java:93) ~[junit-platform-launcher-1.10.2.jar:1.10.2]
	at org.junit.platform.launcher.core.EngineExecutionOrchestrator.lambda$execute$0(EngineExecutionOrchestrator.java:58) ~[junit-platform-launcher-1.10.2.jar:1.10.2]
	at org.junit.platform.launcher.core.EngineExecutionOrchestrator.withInterceptedStreams(EngineExecutionOrchestrator.java:141) ~[junit-platform-launcher-1.10.2.jar:1.10.2]
	at org.junit.platform.launcher.core.EngineExecutionOrchestrator.execute(EngineExecutionOrchestrator.java:57) ~[junit-platform-launcher-1.10.2.jar:1.10.2]
	at org.junit.platform.launcher.core.DefaultLauncher.execute(DefaultLauncher.java:103) ~[junit-platform-launcher-1.10.2.jar:1.10.2]
	at org.junit.platform.launcher.core.DefaultLauncher.execute(DefaultLauncher.java:85) ~[junit-platform-launcher-1.10.2.jar:1.10.2]
	at org.junit.platform.launcher.core.DelegatingLauncher.execute(DelegatingLauncher.java:47) ~[junit-platform-launcher-1.10.2.jar:1.10.2]
	at org.apache.maven.surefire.junitplatform.LazyLauncher.execute(LazyLauncher.java:56) ~[surefire-junit-platform-3.1.2.jar:3.1.2]
	at org.apache.maven.surefire.junitplatform.JUnitPlatformProvider.execute(JUnitPlatformProvider.java:184) ~[surefire-junit-platform-3.1.2.jar:3.1.2]
	at org.apache.maven.surefire.junitplatform.JUnitPlatformProvider.invokeAllTests(JUnitPlatformProvider.java:148) ~[surefire-junit-platform-3.1.2.jar:3.1.2]
	at org.apache.maven.surefire.junitplatform.JUnitPlatformProvider.invoke(JUnitPlatformProvider.java:122) ~[surefire-junit-platform-3.1.2.jar:3.1.2]
	at org.apache.maven.surefire.booter.ForkedBooter.runSuitesInProcess(ForkedBooter.java:385) ~[surefire-booter-3.1.2.jar:3.1.2]
	at org.apache.maven.surefire.booter.ForkedBooter.execute(ForkedBooter.java:162) ~[surefire-booter-3.1.2.jar:3.1.2]
	at org.apache.maven.surefire.booter.ForkedBooter.run(ForkedBooter.java:507) ~[surefire-booter-3.1.2.jar:3.1.2]
	at org.apache.maven.surefire.booter.ForkedBooter.main(ForkedBooter.java:495) ~[surefire-booter-3.1.2.jar:3.1.2]
Caused by: java.lang.IllegalArgumentException: Could not resolve placeholder 'general.kafka-topic' in value "${general.kafka-topic}"
	at org.springframework.util.PropertyPlaceholderHelper.parseStringValue(PropertyPlaceholderHelper.java:180) ~[spring-core-6.1.6.jar:6.1.6]
	at org.springframework.util.PropertyPlaceholderHelper.replacePlaceholders(PropertyPlaceholderHelper.java:126) ~[spring-core-6.1.6.jar:6.1.6]
	at org.springframework.core.env.AbstractPropertyResolver.doResolvePlaceholders(AbstractPropertyResolver.java:239) ~[spring-core-6.1.6.jar:6.1.6]
	at org.springframework.core.env.AbstractPropertyResolver.resolveRequiredPlaceholders(AbstractPropertyResolver.java:210) ~[spring-core-6.1.6.jar:6.1.6]
	at org.springframework.context.support.PropertySourcesPlaceholderConfigurer.lambda$processProperties$0(PropertySourcesPlaceholderConfigurer.java:200) ~[spring-context-6.1.6.jar:6.1.6]
	at org.springframework.beans.factory.support.AbstractBeanFactory.resolveEmbeddedValue(AbstractBeanFactory.java:953) ~[spring-beans-6.1.6.jar:6.1.6]
	at org.springframework.beans.factory.support.DefaultListableBeanFactory.doResolveDependency(DefaultListableBeanFactory.java:1374) ~[spring-beans-6.1.6.jar:6.1.6]
	at org.springframework.beans.factory.support.DefaultListableBeanFactory.resolveDependency(DefaultListableBeanFactory.java:1353) ~[spring-beans-6.1.6.jar:6.1.6]
	at org.springframework.beans.factory.support.ConstructorResolver.resolveAutowiredArgument(ConstructorResolver.java:904) ~[spring-beans-6.1.6.jar:6.1.6]
	at org.springframework.beans.factory.support.ConstructorResolver.createArgumentArray(ConstructorResolver.java:782) ~[spring-beans-6.1.6.jar:6.1.6]
	at org.springframework.beans.factory.support.ConstructorResolver.autowireConstructor(ConstructorResolver.java:237) ~[spring-beans-6.1.6.jar:6.1.6]
	at org.springframework.beans.factory.support.AbstractAutowireCapableBeanFactory.autowireConstructor(AbstractAutowireCapableBeanFactory.java:1355) ~[spring-beans-6.1.6.jar:6.1.6]
	at org.springframework.beans.factory.support.AbstractAutowireCapableBeanFactory.createBeanInstance(AbstractAutowireCapableBeanFactory.java:1192) ~[spring-beans-6.1.6.jar:6.1.6]
	at org.springframework.beans.factory.support.AbstractAutowireCapableBeanFactory.doCreateBean(AbstractAutowireCapableBeanFactory.java:562) ~[spring-beans-6.1.6.jar:6.1.6]
	at org.springframework.beans.factory.support.AbstractAutowireCapableBeanFactory.createBean(AbstractAutowireCapableBeanFactory.java:522) ~[spring-beans-6.1.6.jar:6.1.6]
	... 92 common frames omitted

2025-10-30T14:36:06.568-04:00  WARN 29144 --- [           main] o.s.test.context.TestContextManager      : Caught exception while allowing TestExecutionListener [org.springframework.test.context.web.ServletTestExecutionListener] to prepare test instance [com.jpmc.midascore.TaskOneTests@575cfec1]

java.lang.IllegalStateException: Failed to load ApplicationContext for [WebMergedContextConfiguration@37b1218 testClass = com.jpmc.midascore.TaskOneTests, locations = [], classes = [com.jpmc.midascore.MidasCoreApplication], contextInitializerClasses = [], activeProfiles = [], propertySourceDescriptors = [], propertySourceProperties = ["org.springframework.boot.test.context.SpringBootTestContextBootstrapper=true"], contextCustomizers = [org.springframework.boot.test.context.filter.ExcludeFilterContextCustomizer@28261e8e, org.springframework.boot.test.json.DuplicateJsonObjectContextCustomizerFactory$DuplicateJsonObjectContextCustomizer@3ba987b8, org.springframework.boot.test.mock.mockito.MockitoContextCustomizer@0, org.springframework.boot.test.web.client.TestRestTemplateContextCustomizer@57a78e3, org.springframework.boot.test.autoconfigure.actuate.observability.ObservabilityContextCustomizerFactory$DisableObservabilityContextCustomizer@1f, org.springframework.boot.test.autoconfigure.properties.PropertyMappingContextCustomizer@0, org.springframework.boot.test.autoconfigure.web.servlet.WebDriverContextCustomizer@19932c16, org.springframework.boot.test.context.SpringBootTestAnnotation@cc49848d], resourceBasePath = "src/main/webapp", contextLoader = org.springframework.boot.test.context.SpringBootContextLoader, parent = null]
	at org.springframework.test.context.cache.DefaultCacheAwareContextLoaderDelegate.loadContext(DefaultCacheAwareContextLoaderDelegate.java:180) ~[spring-test-6.1.6.jar:6.1.6]
	at org.springframework.test.context.support.DefaultTestContext.getApplicationContext(DefaultTestContext.java:130) ~[spring-test-6.1.6.jar:6.1.6]
	at org.springframework.test.context.web.ServletTestExecutionListener.setUpRequestContextIfNecessary(ServletTestExecutionListener.java:191) ~[spring-test-6.1.6.jar:6.1.6]
	at org.springframework.test.context.web.ServletTestExecutionListener.prepareTestInstance(ServletTestExecutionListener.java:130) ~[spring-test-6.1.6.jar:6.1.6]
	at org.springframework.test.context.TestContextManager.prepareTestInstance(TestContextManager.java:260) ~[spring-test-6.1.6.jar:6.1.6]
	at org.springframework.test.context.junit.jupiter.SpringExtension.postProcessTestInstance(SpringExtension.java:163) ~[spring-test-6.1.6.jar:6.1.6]
	at org.junit.jupiter.engine.descriptor.ClassBasedTestDescriptor.lambda$invokeTestInstancePostProcessors$10(ClassBasedTestDescriptor.java:378) ~[junit-jupiter-engine-5.10.2.jar:5.10.2]
	at org.junit.jupiter.engine.descriptor.ClassBasedTestDescriptor.executeAndMaskThrowable(ClassBasedTestDescriptor.java:383) ~[junit-jupiter-engine-5.10.2.jar:5.10.2]
	at org.junit.jupiter.engine.descriptor.ClassBasedTestDescriptor.lambda$invokeTestInstancePostProcessors$11(ClassBasedTestDescriptor.java:378) ~[junit-jupiter-engine-5.10.2.jar:5.10.2]
	at java.base/java.util.stream.ReferencePipeline$3$1.accept(ReferencePipeline.java:214) ~[na:na]
	at java.base/java.util.stream.ReferencePipeline$2$1.accept(ReferencePipeline.java:197) ~[na:na]
	at java.base/java.util.ArrayList$ArrayListSpliterator.forEachRemaining(ArrayList.java:1716) ~[na:na]
	at java.base/java.util.stream.AbstractPipeline.copyInto(AbstractPipeline.java:570) ~[na:na]
	at java.base/java.util.stream.AbstractPipeline.wrapAndCopyInto(AbstractPipeline.java:560) ~[na:na]
	at java.base/java.util.stream.StreamSpliterators$WrappingSpliterator.forEachRemaining(StreamSpliterators.java:315) ~[na:na]
	at java.base/java.util.stream.Streams$ConcatSpliterator.forEachRemaining(Streams.java:735) ~[na:na]
	at java.base/java.util.stream.Streams$ConcatSpliterator.forEachRemaining(Streams.java:734) ~[na:na]
	at java.base/java.util.stream.ReferencePipeline$Head.forEach(ReferencePipeline.java:803) ~[na:na]
	at org.junit.jupiter.engine.descriptor.ClassBasedTestDescriptor.invokeTestInstancePostProcessors(ClassBasedTestDescriptor.java:377) ~[junit-jupiter-engine-5.10.2.jar:5.10.2]
	at org.junit.jupiter.engine.descriptor.ClassBasedTestDescriptor.lambda$instantiateAndPostProcessTestInstance$6(ClassBasedTestDescriptor.java:290) ~[junit-jupiter-engine-5.10.2.jar:5.10.2]
	at org.junit.platform.engine.support.hierarchical.ThrowableCollector.execute(ThrowableCollector.java:73) ~[junit-platform-engine-1.10.2.jar:1.10.2]
	at org.junit.jupiter.engine.descriptor.ClassBasedTestDescriptor.instantiateAndPostProcessTestInstance(ClassBasedTestDescriptor.java:289) ~[junit-jupiter-engine-5.10.2.jar:5.10.2]
	at org.junit.jupiter.engine.descriptor.ClassBasedTestDescriptor.lambda$testInstancesProvider$4(ClassBasedTestDescriptor.java:279) ~[junit-jupiter-engine-5.10.2.jar:5.10.2]
	at java.base/java.util.Optional.orElseGet(Optional.java:364) ~[na:na]
	at org.junit.jupiter.engine.descriptor.ClassBasedTestDescriptor.lambda$testInstancesProvider$5(ClassBasedTestDescriptor.java:278) ~[junit-jupiter-engine-5.10.2.jar:5.10.2]
	at org.junit.jupiter.engine.execution.TestInstancesProvider.getTestInstances(TestInstancesProvider.java:31) ~[junit-jupiter-engine-5.10.2.jar:5.10.2]
	at org.junit.jupiter.engine.descriptor.TestMethodTestDescriptor.lambda$prepare$0(TestMethodTestDescriptor.java:106) ~[junit-jupiter-engine-5.10.2.jar:5.10.2]
	at org.junit.platform.engine.support.hierarchical.ThrowableCollector.execute(ThrowableCollector.java:73) ~[junit-platform-engine-1.10.2.jar:1.10.2]
	at org.junit.jupiter.engine.descriptor.TestMethodTestDescriptor.prepare(TestMethodTestDescriptor.java:105) ~[junit-jupiter-engine-5.10.2.jar:5.10.2]
	at org.junit.jupiter.engine.descriptor.TestMethodTestDescriptor.prepare(TestMethodTestDescriptor.java:69) ~[junit-jupiter-engine-5.10.2.jar:5.10.2]
	at org.junit.platform.engine.support.hierarchical.NodeTestTask.lambda$prepare$2(NodeTestTask.java:123) ~[junit-platform-engine-1.10.2.jar:1.10.2]
	at org.junit.platform.engine.support.hierarchical.ThrowableCollector.execute(ThrowableCollector.java:73) ~[junit-platform-engine-1.10.2.jar:1.10.2]
	at org.junit.platform.engine.support.hierarchical.NodeTestTask.prepare(NodeTestTask.java:123) ~[junit-platform-engine-1.10.2.jar:1.10.2]
	at org.junit.platform.engine.support.hierarchical.NodeTestTask.execute(NodeTestTask.java:90) ~[junit-platform-engine-1.10.2.jar:1.10.2]
	at java.base/java.util.ArrayList.forEach(ArrayList.java:1604) ~[na:na]
	at org.junit.platform.engine.support.hierarchical.SameThreadHierarchicalTestExecutorService.invokeAll(SameThreadHierarchicalTestExecutorService.java:41) ~[junit-platform-engine-1.10.2.jar:1.10.2]
	at org.junit.platform.engine.support.hierarchical.NodeTestTask.lambda$executeRecursively$6(NodeTestTask.java:155) ~[junit-platform-engine-1.10.2.jar:1.10.2]
	at org.junit.platform.engine.support.hierarchical.ThrowableCollector.execute(ThrowableCollector.java:73) ~[junit-platform-engine-1.10.2.jar:1.10.2]
	at org.junit.platform.engine.support.hierarchical.NodeTestTask.lambda$executeRecursively$8(NodeTestTask.java:141) ~[junit-platform-engine-1.10.2.jar:1.10.2]
	at org.junit.platform.engine.support.hierarchical.Node.around(Node.java:137) ~[junit-platform-engine-1.10.2.jar:1.10.2]
	at org.junit.platform.engine.support.hierarchical.NodeTestTask.lambda$executeRecursively$9(NodeTestTask.java:139) ~[junit-platform-engine-1.10.2.jar:1.10.2]
	at org.junit.platform.engine.support.hierarchical.ThrowableCollector.execute(ThrowableCollector.java:73) ~[junit-platform-engine-1.10.2.jar:1.10.2]
	at org.junit.platform.engine.support.hierarchical.NodeTestTask.executeRecursively(NodeTestTask.java:138) ~[junit-platform-engine-1.10.2.jar:1.10.2]
	at org.junit.platform.engine.support.hierarchical.NodeTestTask.execute(NodeTestTask.java:95) ~[junit-platform-engine-1.10.2.jar:1.10.2]
	at java.base/java.util.ArrayList.forEach(ArrayList.java:1604) ~[na:na]
	at org.junit.platform.engine.support.hierarchical.SameThreadHierarchicalTestExecutorService.invokeAll(SameThreadHierarchicalTestExecutorService.java:41) ~[junit-platform-engine-1.10.2.jar:1.10.2]
	at org.junit.platform.engine.support.hierarchical.NodeTestTask.lambda$executeRecursively$6(NodeTestTask.java:155) ~[junit-platform-engine-1.10.2.jar:1.10.2]
	at org.junit.platform.engine.support.hierarchical.ThrowableCollector.execute(ThrowableCollector.java:73) ~[junit-platform-engine-1.10.2.jar:1.10.2]
	at org.junit.platform.engine.support.hierarchical.NodeTestTask.lambda$executeRecursively$8(NodeTestTask.java:141) ~[junit-platform-engine-1.10.2.jar:1.10.2]
	at org.junit.platform.engine.support.hierarchical.Node.around(Node.java:137) ~[junit-platform-engine-1.10.2.jar:1.10.2]
	at org.junit.platform.engine.support.hierarchical.NodeTestTask.lambda$executeRecursively$9(NodeTestTask.java:139) ~[junit-platform-engine-1.10.2.jar:1.10.2]
	at org.junit.platform.engine.support.hierarchical.ThrowableCollector.execute(ThrowableCollector.java:73) ~[junit-platform-engine-1.10.2.jar:1.10.2]
	at org.junit.platform.engine.support.hierarchical.NodeTestTask.executeRecursively(NodeTestTask.java:138) ~[junit-platform-engine-1.10.2.jar:1.10.2]
	at org.junit.platform.engine.support.hierarchical.NodeTestTask.execute(NodeTestTask.java:95) ~[junit-platform-engine-1.10.2.jar:1.10.2]
	at org.junit.platform.engine.support.hierarchical.SameThreadHierarchicalTestExecutorService.submit(SameThreadHierarchicalTestExecutorService.java:35) ~[junit-platform-engine-1.10.2.jar:1.10.2]
	at org.junit.platform.engine.support.hierarchical.HierarchicalTestExecutor.execute(HierarchicalTestExecutor.java:57) ~[junit-platform-engine-1.10.2.jar:1.10.2]
	at org.junit.platform.engine.support.hierarchical.HierarchicalTestEngine.execute(HierarchicalTestEngine.java:54) ~[junit-platform-engine-1.10.2.jar:1.10.2]
	at org.junit.platform.launcher.core.EngineExecutionOrchestrator.execute(EngineExecutionOrchestrator.java:198) ~[junit-platform-launcher-1.10.2.jar:1.10.2]
	at org.junit.platform.launcher.core.EngineExecutionOrchestrator.execute(EngineExecutionOrchestrator.java:169) ~[junit-platform-launcher-1.10.2.jar:1.10.2]
	at org.junit.platform.launcher.core.EngineExecutionOrchestrator.execute(EngineExecutionOrchestrator.java:93) ~[junit-platform-launcher-1.10.2.jar:1.10.2]
	at org.junit.platform.launcher.core.EngineExecutionOrchestrator.lambda$execute$0(EngineExecutionOrchestrator.java:58) ~[junit-platform-launcher-1.10.2.jar:1.10.2]
	at org.junit.platform.launcher.core.EngineExecutionOrchestrator.withInterceptedStreams(EngineExecutionOrchestrator.java:141) ~[junit-platform-launcher-1.10.2.jar:1.10.2]
	at org.junit.platform.launcher.core.EngineExecutionOrchestrator.execute(EngineExecutionOrchestrator.java:57) ~[junit-platform-launcher-1.10.2.jar:1.10.2]
	at org.junit.platform.launcher.core.DefaultLauncher.execute(DefaultLauncher.java:103) ~[junit-platform-launcher-1.10.2.jar:1.10.2]
	at org.junit.platform.launcher.core.DefaultLauncher.execute(DefaultLauncher.java:85) ~[junit-platform-launcher-1.10.2.jar:1.10.2]
	at org.junit.platform.launcher.core.DelegatingLauncher.execute(DelegatingLauncher.java:47) ~[junit-platform-launcher-1.10.2.jar:1.10.2]
	at org.apache.maven.surefire.junitplatform.LazyLauncher.execute(LazyLauncher.java:56) ~[surefire-junit-platform-3.1.2.jar:3.1.2]
	at org.apache.maven.surefire.junitplatform.JUnitPlatformProvider.execute(JUnitPlatformProvider.java:184) ~[surefire-junit-platform-3.1.2.jar:3.1.2]
	at org.apache.maven.surefire.junitplatform.JUnitPlatformProvider.invokeAllTests(JUnitPlatformProvider.java:148) ~[surefire-junit-platform-3.1.2.jar:3.1.2]
	at org.apache.maven.surefire.junitplatform.JUnitPlatformProvider.invoke(JUnitPlatformProvider.java:122) ~[surefire-junit-platform-3.1.2.jar:3.1.2]
	at org.apache.maven.surefire.booter.ForkedBooter.runSuitesInProcess(ForkedBooter.java:385) ~[surefire-booter-3.1.2.jar:3.1.2]
	at org.apache.maven.surefire.booter.ForkedBooter.execute(ForkedBooter.java:162) ~[surefire-booter-3.1.2.jar:3.1.2]
	at org.apache.maven.surefire.booter.ForkedBooter.run(ForkedBooter.java:507) ~[surefire-booter-3.1.2.jar:3.1.2]
	at org.apache.maven.surefire.booter.ForkedBooter.main(ForkedBooter.java:495) ~[surefire-booter-3.1.2.jar:3.1.2]
Caused by: org.springframework.beans.factory.BeanCreationException: Error creating bean with name 'kafkaProducer' defined in file [D:\NJIT FILES\Stimulations\JPMC_Project\forage-midas-flow\target\test-classes\com\jpmc\midascore\KafkaProducer.class]: Unexpected exception during bean creation
	at org.springframework.beans.factory.support.AbstractAutowireCapableBeanFactory.createBean(AbstractAutowireCapableBeanFactory.java:535) ~[spring-beans-6.1.6.jar:6.1.6]
	at org.springframework.beans.factory.support.AbstractBeanFactory.lambda$doGetBean$0(AbstractBeanFactory.java:326) ~[spring-beans-6.1.6.jar:6.1.6]
	at org.springframework.beans.factory.support.DefaultSingletonBeanRegistry.getSingleton(DefaultSingletonBeanRegistry.java:234) ~[spring-beans-6.1.6.jar:6.1.6]
	at org.springframework.beans.factory.support.AbstractBeanFactory.doGetBean(AbstractBeanFactory.java:324) ~[spring-beans-6.1.6.jar:6.1.6]
	at org.springframework.beans.factory.support.AbstractBeanFactory.getBean(AbstractBeanFactory.java:200) ~[spring-beans-6.1.6.jar:6.1.6]
	at org.springframework.beans.factory.support.DefaultListableBeanFactory.preInstantiateSingletons(DefaultListableBeanFactory.java:975) ~[spring-beans-6.1.6.jar:6.1.6]
	at org.springframework.context.support.AbstractApplicationContext.finishBeanFactoryInitialization(AbstractApplicationContext.java:962) ~[spring-context-6.1.6.jar:6.1.6]
	at org.springframework.context.support.AbstractApplicationContext.refresh(AbstractApplicationContext.java:624) ~[spring-context-6.1.6.jar:6.1.6]
	at org.springframework.boot.SpringApplication.refresh(SpringApplication.java:754) ~[spring-boot-3.2.5.jar:3.2.5]
	at org.springframework.boot.SpringApplication.refreshContext(SpringApplication.java:456) ~[spring-boot-3.2.5.jar:3.2.5]
	at org.springframework.boot.SpringApplication.run(SpringApplication.java:334) ~[spring-boot-3.2.5.jar:3.2.5]
	at org.springframework.boot.test.context.SpringBootContextLoader.lambda$loadContext$3(SpringBootContextLoader.java:137) ~[spring-boot-test-3.2.5.jar:3.2.5]
	at org.springframework.util.function.ThrowingSupplier.get(ThrowingSupplier.java:58) ~[spring-core-6.1.6.jar:6.1.6]
	at org.springframework.util.function.ThrowingSupplier.get(ThrowingSupplier.java:46) ~[spring-core-6.1.6.jar:6.1.6]
	at org.springframework.boot.SpringApplication.withHook(SpringApplication.java:1454) ~[spring-boot-3.2.5.jar:3.2.5]
	at org.springframework.boot.test.context.SpringBootContextLoader$ContextLoaderHook.run(SpringBootContextLoader.java:553) ~[spring-boot-test-3.2.5.jar:3.2.5]
	at org.springframework.boot.test.context.SpringBootContextLoader.loadContext(SpringBootContextLoader.java:137) ~[spring-boot-test-3.2.5.jar:3.2.5]
	at org.springframework.boot.test.context.SpringBootContextLoader.loadContext(SpringBootContextLoader.java:108) ~[spring-boot-test-3.2.5.jar:3.2.5]
	at org.springframework.test.context.cache.DefaultCacheAwareContextLoaderDelegate.loadContextInternal(DefaultCacheAwareContextLoaderDelegate.java:225) ~[spring-test-6.1.6.jar:6.1.6]
	at org.springframework.test.context.cache.DefaultCacheAwareContextLoaderDelegate.loadContext(DefaultCacheAwareContextLoaderDelegate.java:152) ~[spring-test-6.1.6.jar:6.1.6]
	... 73 common frames omitted
Caused by: java.lang.IllegalArgumentException: Could not resolve placeholder 'general.kafka-topic' in value "${general.kafka-topic}"
	at org.springframework.util.PropertyPlaceholderHelper.parseStringValue(PropertyPlaceholderHelper.java:180) ~[spring-core-6.1.6.jar:6.1.6]
	at org.springframework.util.PropertyPlaceholderHelper.replacePlaceholders(PropertyPlaceholderHelper.java:126) ~[spring-core-6.1.6.jar:6.1.6]
	at org.springframework.core.env.AbstractPropertyResolver.doResolvePlaceholders(AbstractPropertyResolver.java:239) ~[spring-core-6.1.6.jar:6.1.6]
	at org.springframework.core.env.AbstractPropertyResolver.resolveRequiredPlaceholders(AbstractPropertyResolver.java:210) ~[spring-core-6.1.6.jar:6.1.6]
	at org.springframework.context.support.PropertySourcesPlaceholderConfigurer.lambda$processProperties$0(PropertySourcesPlaceholderConfigurer.java:200) ~[spring-context-6.1.6.jar:6.1.6]
	at org.springframework.beans.factory.support.AbstractBeanFactory.resolveEmbeddedValue(AbstractBeanFactory.java:953) ~[spring-beans-6.1.6.jar:6.1.6]
	at org.springframework.beans.factory.support.DefaultListableBeanFactory.doResolveDependency(DefaultListableBeanFactory.java:1374) ~[spring-beans-6.1.6.jar:6.1.6]
	at org.springframework.beans.factory.support.DefaultListableBeanFactory.resolveDependency(DefaultListableBeanFactory.java:1353) ~[spring-beans-6.1.6.jar:6.1.6]
	at org.springframework.beans.factory.support.ConstructorResolver.resolveAutowiredArgument(ConstructorResolver.java:904) ~[spring-beans-6.1.6.jar:6.1.6]
	at org.springframework.beans.factory.support.ConstructorResolver.createArgumentArray(ConstructorResolver.java:782) ~[spring-beans-6.1.6.jar:6.1.6]
	at org.springframework.beans.factory.support.ConstructorResolver.autowireConstructor(ConstructorResolver.java:237) ~[spring-beans-6.1.6.jar:6.1.6]
	at org.springframework.beans.factory.support.AbstractAutowireCapableBeanFactory.autowireConstructor(AbstractAutowireCapableBeanFactory.java:1355) ~[spring-beans-6.1.6.jar:6.1.6]
	at org.springframework.beans.factory.support.AbstractAutowireCapableBeanFactory.createBeanInstance(AbstractAutowireCapableBeanFactory.java:1192) ~[spring-beans-6.1.6.jar:6.1.6]
	at org.springframework.beans.factory.support.AbstractAutowireCapableBeanFactory.doCreateBean(AbstractAutowireCapableBeanFactory.java:562) ~[spring-beans-6.1.6.jar:6.1.6]
	at org.springframework.beans.factory.support.AbstractAutowireCapableBeanFactory.createBean(AbstractAutowireCapableBeanFactory.java:522) ~[spring-beans-6.1.6.jar:6.1.6]
	... 92 common frames omitted

[ERROR] Tests run: 1, Failures: 0, Errors: 1, Skipped: 0, Time elapsed: 4.391 s <<< FAILURE! -- in com.jpmc.midascore.TaskOneTests
[ERROR] com.jpmc.midascore.TaskOneTests.task_one_verifier -- Time elapsed: 0.020 s <<< ERROR!
java.lang.IllegalStateException: Failed to load ApplicationContext for [WebMergedContextConfiguration@37b1218 testClass = com.jpmc.midascore.TaskOneTests, locations = [], classes = [com.jpmc.midascore.MidasCoreApplication], contextInitializerClasses = [], activeProfiles = [], propertySourceDescriptors = [], propertySourceProperties = ["org.springframework.boot.test.context.SpringBootTestContextBootstrapper=true"], contextCustomizers = [org.springframework.boot.test.context.filter.ExcludeFilterContextCustomizer@28261e8e, org.springframework.boot.test.json.DuplicateJsonObjectContextCustomizerFactory$DuplicateJsonObjectContextCustomizer@3ba987b8, org.springframework.boot.test.mock.mockito.MockitoContextCustomizer@0, org.springframework.boot.test.web.client.TestRestTemplateContextCustomizer@57a78e3, org.springframework.boot.test.autoconfigure.actuate.observability.ObservabilityContextCustomizerFactory$DisableObservabilityContextCustomizer@1f, org.springframework.boot.test.autoconfigure.properties.PropertyMappingContextCustomizer@0, org.springframework.boot.test.autoconfigure.web.servlet.WebDriverContextCustomizer@19932c16, org.springframework.boot.test.context.SpringBootTestAnnotation@cc49848d], resourceBasePath = "src/main/webapp", contextLoader = org.springframework.boot.test.context.SpringBootContextLoader, parent = null]
	at org.springframework.test.context.cache.DefaultCacheAwareContextLoaderDelegate.loadContext(DefaultCacheAwareContextLoaderDelegate.java:180)
	at org.springframework.test.context.support.DefaultTestContext.getApplicationContext(DefaultTestContext.java:130)
	at org.springframework.test.context.web.ServletTestExecutionListener.setUpRequestContextIfNecessary(ServletTestExecutionListener.java:191)
	at org.springframework.test.context.web.ServletTestExecutionListener.prepareTestInstance(ServletTestExecutionListener.java:130)
	at org.springframework.test.context.TestContextManager.prepareTestInstance(TestContextManager.java:260)
	at org.springframework.test.context.junit.jupiter.SpringExtension.postProcessTestInstance(SpringExtension.java:163)
	at java.base/java.util.stream.ReferencePipeline$3$1.accept(ReferencePipeline.java:214)
	at java.base/java.util.stream.ReferencePipeline$2$1.accept(ReferencePipeline.java:197)
	at java.base/java.util.ArrayList$ArrayListSpliterator.forEachRemaining(ArrayList.java:1716)
	at java.base/java.util.stream.AbstractPipeline.copyInto(AbstractPipeline.java:570)
	at java.base/java.util.stream.AbstractPipeline.wrapAndCopyInto(AbstractPipeline.java:560)
	at java.base/java.util.stream.StreamSpliterators$WrappingSpliterator.forEachRemaining(StreamSpliterators.java:315)
	at java.base/java.util.stream.Streams$ConcatSpliterator.forEachRemaining(Streams.java:735)
	at java.base/java.util.stream.Streams$ConcatSpliterator.forEachRemaining(Streams.java:734)
	at java.base/java.util.stream.ReferencePipeline$Head.forEach(ReferencePipeline.java:803)
	at java.base/java.util.Optional.orElseGet(Optional.java:364)
	at java.base/java.util.ArrayList.forEach(ArrayList.java:1604)
	at java.base/java.util.ArrayList.forEach(ArrayList.java:1604)
Caused by: org.springframework.beans.factory.BeanCreationException: Error creating bean with name 'kafkaProducer' defined in file [D:\NJIT FILES\Stimulations\JPMC_Project\forage-midas-flow\target\test-classes\com\jpmc\midascore\KafkaProducer.class]: Unexpected exception during bean creation
	at org.springframework.beans.factory.support.AbstractAutowireCapableBeanFactory.createBean(AbstractAutowireCapableBeanFactory.java:535)
	at org.springframework.beans.factory.support.AbstractBeanFactory.lambda$doGetBean$0(AbstractBeanFactory.java:326)
	at org.springframework.beans.factory.support.DefaultSingletonBeanRegistry.getSingleton(DefaultSingletonBeanRegistry.java:234)
	at org.springframework.beans.factory.support.AbstractBeanFactory.doGetBean(AbstractBeanFactory.java:324)
	at org.springframework.beans.factory.support.AbstractBeanFactory.getBean(AbstractBeanFactory.java:200)
	at org.springframework.beans.factory.support.DefaultListableBeanFactory.preInstantiateSingletons(DefaultListableBeanFactory.java:975)
	at org.springframework.context.support.AbstractApplicationContext.finishBeanFactoryInitialization(AbstractApplicationContext.java:962)
	at org.springframework.context.support.AbstractApplicationContext.refresh(AbstractApplicationContext.java:624)
	at org.springframework.boot.SpringApplication.refresh(SpringApplication.java:754)
	at org.springframework.boot.SpringApplication.refreshContext(SpringApplication.java:456)
	at org.springframework.boot.SpringApplication.run(SpringApplication.java:334)
	at org.springframework.boot.test.context.SpringBootContextLoader.lambda$loadContext$3(SpringBootContextLoader.java:137)
	at org.springframework.util.function.ThrowingSupplier.get(ThrowingSupplier.java:58)
	at org.springframework.util.function.ThrowingSupplier.get(ThrowingSupplier.java:46)
	at org.springframework.boot.SpringApplication.withHook(SpringApplication.java:1454)
	at org.springframework.boot.test.context.SpringBootContextLoader$ContextLoaderHook.run(SpringBootContextLoader.java:553)
	at org.springframework.boot.test.context.SpringBootContextLoader.loadContext(SpringBootContextLoader.java:137)
	at org.springframework.boot.test.context.SpringBootContextLoader.loadContext(SpringBootContextLoader.java:108)
	at org.springframework.test.context.cache.DefaultCacheAwareContextLoaderDelegate.loadContextInternal(DefaultCacheAwareContextLoaderDelegate.java:225)
	at org.springframework.test.context.cache.DefaultCacheAwareContextLoaderDelegate.loadContext(DefaultCacheAwareContextLoaderDelegate.java:152)
	... 17 more
Caused by: java.lang.IllegalArgumentException: Could not resolve placeholder 'general.kafka-topic' in value "${general.kafka-topic}"
	at org.springframework.util.PropertyPlaceholderHelper.parseStringValue(PropertyPlaceholderHelper.java:180)
	at org.springframework.util.PropertyPlaceholderHelper.replacePlaceholders(PropertyPlaceholderHelper.java:126)
	at org.springframework.core.env.AbstractPropertyResolver.doResolvePlaceholders(AbstractPropertyResolver.java:239)
	at org.springframework.core.env.AbstractPropertyResolver.resolveRequiredPlaceholders(AbstractPropertyResolver.java:210)
	at org.springframework.context.support.PropertySourcesPlaceholderConfigurer.lambda$processProperties$0(PropertySourcesPlaceholderConfigurer.java:200)
	at org.springframework.beans.factory.support.AbstractBeanFactory.resolveEmbeddedValue(AbstractBeanFactory.java:953)
	at org.springframework.beans.factory.support.DefaultListableBeanFactory.doResolveDependency(DefaultListableBeanFactory.java:1374)
	at org.springframework.beans.factory.support.DefaultListableBeanFactory.resolveDependency(DefaultListableBeanFactory.java:1353)
	at org.springframework.beans.factory.support.ConstructorResolver.resolveAutowiredArgument(ConstructorResolver.java:904)
	at org.springframework.beans.factory.support.ConstructorResolver.createArgumentArray(ConstructorResolver.java:782)
	at org.springframework.beans.factory.support.ConstructorResolver.autowireConstructor(ConstructorResolver.java:237)
	at org.springframework.beans.factory.support.AbstractAutowireCapableBeanFactory.autowireConstructor(AbstractAutowireCapableBeanFactory.java:1355)
	at org.springframework.beans.factory.support.AbstractAutowireCapableBeanFactory.createBeanInstance(AbstractAutowireCapableBeanFactory.java:1192)
	at org.springframework.beans.factory.support.AbstractAutowireCapableBeanFactory.doCreateBean(AbstractAutowireCapableBeanFactory.java:562)
	at org.springframework.beans.factory.support.AbstractAutowireCapableBeanFactory.createBean(AbstractAutowireCapableBeanFactory.java:522)
	... 36 more

[INFO] 
[INFO] Results:
[INFO] 
[ERROR] Errors: 
[ERROR]   TaskOneTests.task_one_verifier » IllegalState Failed to load ApplicationContext for [WebMergedContextConfiguration@37b1218 testClass = com.jpmc.midascore.TaskOneTests, locations = [], classes = [com.jpmc.midascore.MidasCoreApplication], contextInitializerClasses = [], activeProfiles = [], propertySourceDescriptors = [], propertySourceProperties = ["org.springframework.boot.test.context.SpringBootTestContextBootstrapper=true"], contextCustomizers = [org.springframework.boot.test.context.filter.ExcludeFilterContextCustomizer@28261e8e, org.springframework.boot.test.json.DuplicateJsonObjectContextCustomizerFactory$DuplicateJsonObjectContextCustomizer@3ba987b8, org.springframework.boot.test.mock.mockito.MockitoContextCustomizer@0, org.springframework.boot.test.web.client.TestRestTemplateContextCustomizer@57a78e3, org.springframework.boot.test.autoconfigure.actuate.observability.ObservabilityContextCustomizerFactory$DisableObservabilityContextCustomizer@1f, org.springframework.boot.test.autoconfigure.properties.PropertyMappingContextCustomizer@0, org.springframework.boot.test.autoconfigure.web.servlet.WebDriverContextCustomizer@19932c16, org.springframework.boot.test.context.SpringBootTestAnnotation@cc49848d], resourceBasePath = "src/main/webapp", contextLoader = org.springframework.boot.test.context.SpringBootContextLoader, parent = null]
[INFO] 
[ERROR] Tests run: 1, Failures: 0, Errors: 1, Skipped: 0
[INFO] 
[INFO] ------------------------------------------------------------------------
[INFO] BUILD FAILURE
[INFO] ------------------------------------------------------------------------
[INFO] Total time:  7.159 s
[INFO] Finished at: 2025-10-30T14:36:06-04:00
[INFO] ------------------------------------------------------------------------
[ERROR] Failed to execute goal org.apache.maven.plugins:maven-surefire-plugin:3.1.2:test (default-test) on project midas-core: 
[ERROR] 
[ERROR] Please refer to D:\NJIT FILES\Stimulations\JPMC_Project\forage-midas-flow\target\surefire-reports for the individual test results.
[ERROR] Please refer to dump files (if any exist) [date].dump, [date]-jvmRun[N].dump and [date].dumpstream.
[ERROR] -> [Help 1]
[ERROR] 
[ERROR] To see the full stack trace of the errors, re-run Maven with the -e switch.
[ERROR] Re-run Maven using the -X switch to enable full debug logging.
[ERROR] 
[ERROR] For more information about the errors and possible solutions, please read the following articles:
[ERROR] [Help 1] http://cwiki.apache.org/confluence/display/MAVEN/MojoFailureException
